product_id,product_name,category,sub_category,price_per_unit,cost_per_unit
TEC-CIS-10002259,"Cisco Smart Phone, Cordless",Technology,Phones,651.48,19.240115726151664
TEC-MA-10002874,"Epson Receipt Printer, Wireless",Technology,Machines,117.03,38.03555529943133
FUR-CH-10002481,"Hon Executive Leather Armchair, Adjustable",Furniture,Chairs,306.42,282.08794729733313
OFF-ST-10001025,"Tenex Trays, Single Width",Office Supplies,Storage,54.24,1.5935930839179686
OFF-PA-10001735,"Xerox Cards & Envelopes, 8.5 x 11",Office Supplies,Paper,49.11,6.647727045034889
FUR-TA-10003164,"Bevis Wood Table, Rectangular",Furniture,Tables,531.18,419.7515458192919
FUR-NOV-10002791,"Novimex Swivel Stool, Set of Two",Furniture,Chairs,166.71,1.1414287630105961
OFF-AR-10001232,"Sanford Canvas, Fluorescent",Office Supplies,Art,51.78,12.647058975112914
OFF-ST-10003446,"Smead Trays, Single Width",Office Supplies,Storage,48.51,26.160562889496177
OFF-ST-10000430,"Tenex File Cart, Blue",Office Supplies,Storage,133.2,27.323486888752058
FUR-BO-10001155,"Dania 3-Shelf Cabinet, Traditional",Furniture,Bookcases,141.45,4.320450241793969
FUR-CH-10001559,"SAFCO Executive Leather Armchair, Black",Furniture,Chairs,459,351.2868993995935
TEC-CIS-10003439,"Cisco Headset, VoIP",Technology,Phones,88.53,58.69164979925996
OFF-AP-10002734,Holmes Harmony HEPA Air Purifier for 17 x 20 Room,Office Supplies,Appliances,225.04,64.16430894636291
TEC-CO-10001626,"Brother Copy Machine, Color",Technology,Copiers,263.73,10.929056576787403
FUR-CH-10002542,"Office Star Steel Folding Chair, Set of Two",Furniture,Chairs,62.64,3.0078443855318944
OFF-ELI-10001904,"Elite Letter Opener, Steel",Office Supplies,Supplies,24,9.229108421144522
OFF-SU-10004496,"Kleencut Scissors, Easy Grip",Office Supplies,Supplies,23.91,0.4632304721889276
TEC-MA-10002340,"Konica Receipt Printer, White",Technology,Machines,120.66,29.27718574805447
TEC-PH-10004908,Panasonic KX TS3282W Corded phone,Technology,Phones,84.99,22.329124179761763
OFF-ADV-10003030,"Advantus Staples, 12 Pack",Office Supplies,Fasteners,10.29,7.780931454510357
OFF-FA-10002017,"Stockwell Paper Clips, Assorted Sizes",Office Supplies,Fasteners,10.95,0.39241503433152
FUR-TA-10002774,Laminate Occasional Tables,Furniture,Tables,154.13,7.983406613080624
FUR-CH-10001919,"Harbour Creations Steel Folding Chair, Red",Furniture,Chairs,97.89,54.280040340595725
TEC-KON-10000837,"Konica Printer, Durable",Technology,Machines,267.96,82.74779460408473
FUR-BO-10002766,"Bush Classic Bookcase, Traditional",Furniture,Bookcases,275.12,33.69183467198844
OFF-ROG-10001372,"Rogers Trays, Blue",Office Supplies,Storage,61.68,10.145634369286768
FUR-NOV-10002107,"Novimex Rocking Chair, Adjustable",Furniture,Chairs,133.92,60.68666417305328
OFF-ST-10000736,Carina Double Wide Media Storage Towers in Natural & Black,Office Supplies,Storage,80.98,38.868076888093434
TEC-CO-10003525,"Sharp Ink, Color",Technology,Copiers,125.85,0.6962586543303981
FUR-SAF-10000351,"SAFCO Chairmat, Black",Furniture,Chairs,57.39,46.80726606981988
OFF-AP-10000136,"Hamilton Beach Refrigerator, White",Office Supplies,Appliances,498.27,170.40170765153348
FUR-BO-10002682,"Safco Stackable Bookrack, Mobile",Furniture,Bookcases,148.98,103.30253521965928
FUR-CH-10000309,Global Comet Stacking Arm Chair,Furniture,Chairs,422.51,75.81611990192621
TEC-PH-10000037,"Cisco Signal Booster, Cordless",Technology,Phones,154.68,22.86430006715269
FUR-TA-10003473,Bretford Rectangular Conference Table Tops,Furniture,Tables,376.13,28.593517502535466
OFF-SAN-10001634,"Sanford Canvas, Easy-Erase",Office Supplies,Art,50.79,11.118039893633838
TEC-PH-10002085,Clarity 53712,Technology,Phones,65.99,4.320732757037388
TEC-MA-10003366,"Epson Card Printer, White",Technology,Machines,112.24,23.40441526647667
TEC-CO-10004722,Canon imageCLASS 2200 Advanced Copier,Technology,Copiers,3499.99,161.42999486673625
FUR-CH-10002547,"Office Star Steel Folding Chair, Red",Furniture,Chairs,61.14,7.136241408215898
TEC-AC-10003033,Plantronics CS510 - Over-the-Head monaural Wireless Headset System,Technology,Accessories,329.95,2.5819734335659823
TEC-AC-10001438,"SanDisk Flash Drive, Programmable",Technology,Accessories,41.04,9.881535060203536
FUR-CH-10001634,"Novimex Rocking Chair, Adjustable",Furniture,Chairs,89.28,17.980194355105855
TEC-CO-10001391,"Sharp Ink, Color",Technology,Copiers,125.85,79.28465056465926
OFF-EN-10001109,"Ames Interoffice Envelope, Recycled",Office Supplies,Envelopes,43.92,0.2109668886920723
FUR-BO-10004924,"Sauder Library with Doors, Traditional",Furniture,Bookcases,258.42,68.93448912534363
FUR-TA-10003899,"Barricks Round Table, with Bottom Storage",Furniture,Tables,501.51,541.6257364249095
TEC-PH-10004241,Nokia Lumia 1020,Technology,Phones,449.99,314.32260217911545
TEC-KON-10002309,"Konica Inkjet, Wireless",Technology,Machines,313.56,37.92941622870731
TEC-CO-10002657,"Canon Copy Machine, High-Speed",Technology,Copiers,173.56,55.58389086929506
TEC-CO-10000051,"Sharp Wireless Fax, Color",Technology,Copiers,238.24,29.500035437842925
OFF-ST-10003716,Tennsco Double-Tier Lockers,Office Supplies,Storage,225.02,2.8133384186770116
FUR-TA-10004840,"Hon Conference Table, Adjustable Height",Furniture,Tables,615.78,77.88635405656983
TEC-CO-10002911,"Hewlett Wireless Fax, Laser",Technology,Copiers,380.19,70.59466660977014
TEC-HP -10001577,"HP Copy Machine, Laser",Technology,Copiers,243.33,101.90556470703875
TEC-AC-10003047,"SanDisk Keyboard, USB",Technology,Accessories,54.46,16.768074380471795
TEC-CAN-10004214,"Canon Fax and Copier, Color",Technology,Copiers,192.78,24.29799911482332
FUR-CH-10000892,"SAFCO Executive Leather Armchair, Red",Furniture,Chairs,307.62,59.30447805747946
TEC-MA-10002910,"Panasonic Inkjet, Red",Technology,Machines,309.24,185.1032508340356
OFF-BI-10003763,"Ibico Index Tab, Economy",Office Supplies,Binders,10.41,1.4623367414976767
FUR-TA-10003152,"Lesro Round Table, Adjustable Height",Furniture,Tables,454.2,336.0589190218687
OFF-ST-10003411,"Eldon Trays, Wire Frame",Office Supplies,Storage,47.04,0.5000589017860243
FUR-BO-10002964,"Dania Floating Shelf Set, Pine",Furniture,Bookcases,170.7,87.77199528290697
FUR-CH-10001536,"Harbour Creations Chairmat, Red",Furniture,Chairs,72,17.811502151154397
OFF-AP-10003057,Honeywell Enviracaire Portable HEPA Air Cleaner for 16' x 20' Room,Office Supplies,Appliances,275.37,135.97755060761028
TEC-AC-10001840,"SanDisk Mouse, Erganomic",Technology,Accessories,36.12,2.7607034694989463
TEC-CIS-10001877,"Cisco Office Telephone, with Caller ID",Technology,Phones,80.46,64.54427948187299
OFF-BI-10001984,"Ibico Binding Machine, Economy",Office Supplies,Binders,51.42,14.570007165824357
TEC-MA-10002226,"Epson Phone, Red",Technology,Machines,78.12,57.85755165975904
FUR-CH-10001797,"Harbour Creations Bag Chairs, Adjustable",Furniture,Chairs,64.11,14.05095767867588
FUR-TA-10000971,"Bevis Training Table, Rectangular",Furniture,Tables,332.55,215.93240259649113
TEC-MA-10003787,"Panasonic Inkjet, Wireless",Technology,Machines,312.09,79.00172910604296
FUR-SAF-10002846,"Safco Classic Bookcase, Pine",Furniture,Bookcases,439.5,63.58361484620896
TEC-MA-10002464,"Panasonic Printer, Durable",Technology,Machines,266.61,199.30170752424337
FUR-FU-10002292,"Deflect-O Door Stop, Duo Pack",Furniture,Furnishings,44.01,35.145656445863196
OFF-ST-10000675,"File Shuttle II and Handi-File, Black",Office Supplies,Storage,33.89,8.406579622686195
OFF-AP-10001406,"Breville Stove, Black",Office Supplies,Appliances,373.98,132.6160273488731
TEC-CO-10003474,"Brother Personal Copier, Digital",Technology,Copiers,142.53,62.547844875389515
OFF-ST-10002538,"Rogers File Cart, Single Width",Office Supplies,Storage,94.72,21.856038340717724
TEC-MA-10003298,"Konica Card Printer, Wireless",Technology,Machines,175.17,127.5501457665663
OFF-ST-10000288,"Fellowes Lockers, Industrial",Office Supplies,Storage,207.81,4.1361121302164685
FUR-CH-10002932,"Harbour Creations Rocking Chair, Adjustable",Furniture,Chairs,149.58,50.71627164885684
OFF-BI-10000538,"Acco Binding Machine, Clear",Office Supplies,Binders,50.55,15.441332731294555
TEC-OKI-10002736,"Okidata Card Printer, Red",Technology,Machines,172.98,70.51130831788132
OFF-AP-10004755,"KitchenAid Microwave, Black",Office Supplies,Appliances,309.75,56.48981046045135
TEC-CO-10002110,"Brother Personal Copier, Color",Technology,Copiers,96.22,19.94995264927652
OFF-ST-10001638,"Tenex File Cart, Single Width",Office Supplies,Storage,134.61,4.948988196540735
FUR-BO-10001875,"Bush Library with Doors, Mobile",Furniture,Bookcases,366.84,168.1890255162551
OFF-BRE-10002738,"Breville Microwave, Silver",Office Supplies,Appliances,302.46,191.6630424844284
OFF-ST-10002974,"Trav-L-File Heavy-Duty Shuttle II, Black",Office Supplies,Storage,43.57,16.500564816340418
FUR-TA-10003518,"Chromcraft Training Table, Fully Assembled",Furniture,Tables,285.36,1.3634133632393963
FUR-TA-10001664,"Chromcraft Conference Table, with Bottom Storage",Furniture,Tables,872.67,95.48536800940991
TEC-PH-10003171,Plantronics Encore H101 Dual EarpiecesHeadset,Technology,Phones,44.95,17.010164744751368
TEC-MA-10002155,"Panasonic Receipt Printer, Durable",Technology,Machines,121.02,28.515085245211907
OFF-STI-10001955,"Stiletto Box Cutter, Easy Grip",Office Supplies,Supplies,37.59,3.085803797102155
FUR-TA-10001549,"Barricks Coffee Table, Rectangular",Furniture,Tables,299.07,128.40537419607716
FUR-CH-10002543,"SAFCO Steel Folding Chair, Set of Two",Furniture,Chairs,87.96,31.899458818126696
FUR-FU-10003623,"DataProducts Ampli Magnifier Task Lamp, Black,",Furniture,Furnishings,27.06,8.362195628952204
FUR-CH-10001797,"Safco Chair Connectors, 6/Carton",Furniture,Chairs,38.48,4.812225853778902
OFF-FEL-10001261,"Fellowes File Cart, Blue",Office Supplies,Storage,137.31,2.2895784320173265
FUR-BO-10001967,"Safco Corner Shelving, Mobile",Furniture,Bookcases,151.98,79.32543226504535
FUR-SAU-10003795,"Sauder Corner Shelving, Traditional",Furniture,Bookcases,147.3,133.20282984265202
OFF-PA-10003381,"Eaton Cards & Envelopes, Multicolor",Office Supplies,Paper,46.59,34.9030684784703
TEC-MA-10000199,"Okidata Inkjet, White",Technology,Machines,311.25,393.09073259038945
FUR-BO-10000786,"Sauder Stackable Bookrack, Pine",Furniture,Bookcases,148.17,32.32738800420701
OFF-ST-10002566,"Tenex Lockers, Wire Frame",Office Supplies,Storage,203.22,24.537856129003746
TEC-PH-10001425,Mophie Juice Pack Helium for iPhone,Technology,Phones,79.99,20.69716750315472
OFF-AR-10000715,"Boston Markers, Blue",Office Supplies,Art,26.37,8.806538672702535
FUR-TA-10001039,KI Adjustable-Height Table,Furniture,Tables,85.98,9.084573697276875
OFF-ST-10003208,Adjustable Depth Letter/Legal Cart,Office Supplies,Storage,181.46,10.597055413632901
OFF-AP-10000800,"Breville Stove, Red",Office Supplies,Appliances,374.36,10.703271675188466
OFF-ST-10002574,"SAFCO Commercial Wire Shelving, Black",Office Supplies,Storage,138.14,6.010829142935266
FUR-BO-10004371,"Dania Classic Bookcase, Pine",Furniture,Bookcases,274.74,141.3889287265759
OFF-PA-10001758,"Enermax Note Cards, Premium",Office Supplies,Paper,28.5,24.757421791124656
FUR-ADV-10000571,"Advantus Frame, Erganomic",Furniture,Furnishings,109.74,3.5107389866277514
TEC-MA-10003198,"Konica Phone, White",Technology,Machines,84.6,47.2921924675098
FUR-BO-10000034,"Safco Classic Bookcase, Pine",Furniture,Bookcases,439.5,156.7796602066419
TEC-LOG-10003634,"Logitech Numeric Keypad, Programmable",Technology,Accessories,47.82,4.510229734014983
TEC-CO-10002380,"Canon Fax and Copier, High-Speed",Technology,Copiers,189.54,63.20024317431468
TEC-MA-10000875,"Okidata Inkjet, Wireless",Technology,Machines,314.22,177.2819643997917
FUR-BO-10001555,"Bush Corner Shelving, Metal",Furniture,Bookcases,123.45,0.35612089789646884
TEC-MA-10000461,"Epson Inkjet, Wireless",Technology,Machines,308.34,78.7099161797332
TEC-CO-10004169,"HP Ink, Digital",Technology,Copiers,128.34,13.226040842114902
TEC-PH-10001076,"Nokia Smart Phone, Cordless",Technology,Phones,424.1,374.6861290778065
OFF-EN-10003862,Laser & Ink Jet Business Envelopes,Office Supplies,Envelopes,10.67,7.723941806851955
FUR-CH-10001153,"Harbour Creations Bag Chairs, Adjustable",Furniture,Chairs,64.11,3.159074411258281
TEC-CO-10001008,"Canon Fax and Copier, Laser",Technology,Copiers,191.34,8.423774617969029
OFF-BI-10003527,Fellowes PB500 Electric Punch Plastic Comb Binding Machine with Manual Bind,Office Supplies,Binders,1270.99,89.3570456059604
FUR-BO-10003126,"Dania Library with Doors, Traditional",Furniture,Bookcases,362.4,21.239235222917472
OFF-ST-10002781,"Smead File Cart, Single Width",Office Supplies,Storage,85.92,0.6025737139461494
FUR-CH-10003514,"Harbour Creations Rocking Chair, Set of Two",Furniture,Chairs,99.56,61.65696417899227
OFF-AP-10002681,"Hamilton Beach Stove, Black",Office Supplies,Appliances,361.18,46.45480367178897
FUR-BO-10004947,"Safco Stackable Bookrack, Pine",Furniture,Bookcases,150.33,20.350474100222318
TEC-CO-10004976,"Brother Ink, High-Speed",Technology,Copiers,145.5,29.532559892596293
TEC-AC-10002756,"SanDisk Keyboard, Bluetooth",Technology,Accessories,81.48,71.4678396296769
TEC-AC-10003969,"SanDisk Memory Card, USB",Technology,Accessories,112.62,47.59743605824804
FUR-TA-10002497,"Chromcraft Computer Table, Adjustable Height",Furniture,Tables,445.62,191.30307735110082
FUR-TA-10000670,"Chromcraft Coffee Table, Adjustable Height",Furniture,Tables,269.28,44.91754612393226
FUR-BO-10004219,"Safco 3-Shelf Cabinet, Metal",Furniture,Bookcases,168.3,39.550683744216734
TEC-MA-10000697,"StarTech Card Printer, Wireless",Technology,Machines,163.5,19.376893541262092
TEC-CO-10001157,"Hewlett Personal Copier, Color",Technology,Copiers,145.71,5.732826305049033
FUR-BO-10002906,"Ikea Corner Shelving, Traditional",Furniture,Bookcases,82.04,34.159325103572016
FUR-CH-10003841,"Harbour Creations Swivel Stool, Black",Furniture,Chairs,177.69,27.434840452797506
TEC-CO-10001933,"HP Fax Machine, High-Speed",Technology,Copiers,198.76,8.918598971280797
OFF-AR-10002255,"Boston Sketch Pad, Water Color",Office Supplies,Art,51.78,10.725602185222384
FUR-BO-10002250,"Dania Floating Shelf Set, Mobile",Furniture,Bookcases,114.58,16.920149849918992
TEC-CO-10002788,"Hewlett Personal Copier, Digital",Technology,Copiers,143.91,17.20165605540224
TEC-AC-10001792,"Logitech Mouse, Programmable",Technology,Accessories,30.78,23.243504917132114
TEC-MA-10000240,"Okidata Inkjet, Wireless",Technology,Machines,209.4,32.49832381705487
FUR-BO-10001324,"Sauder Floating Shelf Set, Pine",Furniture,Bookcases,195.93,40.410282139805304
TEC-PH-10000292,"Samsung Office Telephone, Full Size",Technology,Phones,66.51,59.92796092079497
FUR-CH-10003750,"Harbour Creations Rocking Chair, Red",Furniture,Chairs,147.09,98.56320784477248
TEC-CO-10000500,"Canon Fax and Copier, High-Speed",Technology,Copiers,189.54,3.236512799650965
TEC-CO-10000338,"Hewlett Fax and Copier, High-Speed",Technology,Copiers,191.07,14.251985224338256
TEC-CO-10000137,"Canon Wireless Fax, Color",Technology,Copiers,253.4,2.702645533380837
OFF-FA-10002388,"Accos Push Pins, Assorted Sizes",Office Supplies,Fasteners,11.97,10.029833077634752
FUR-CH-10002344,"Novimex Rocking Chair, Adjustable",Furniture,Chairs,133.92,26.88141380546388
TEC-CO-10001726,"HP Fax and Copier, High-Speed",Technology,Copiers,171.09,1.182490195079419
TEC-MA-10003558,"Panasonic Calculator, Durable",Technology,Machines,50.4,38.37131907581691
FUR-FU-10000612,"Tenex Frame, Black",Furniture,Furnishings,109.98,67.81026605986348
FUR-BO-10004015,"Bush Andora Bookcase, Maple/Graphite Gray Finish",Furniture,Bookcases,119.99,16.218356685405766
TEC-AC-10001465,SanDisk Cruzer 64 GB USB Flash Drive,Technology,Accessories,36.32,7.80175278864295
FUR-HON-10002599,"Hon Chairmat, Adjustable",Furniture,Chairs,58.02,32.21956441103777
FUR-BO-10001972,O'Sullivan 4-Shelf Bookcase in Odessa Pine,Furniture,Bookcases,120.98,11.932522447129466
FUR-CH-10004795,"SAFCO Swivel Stool, Red",Furniture,Chairs,111.96,14.67046080650539
FUR-CH-10001726,"Office Star Steel Folding Chair, Adjustable",Furniture,Chairs,94.2,5.958088848301729
FUR-BO-10002510,"Safco 3-Shelf Cabinet, Traditional",Furniture,Bookcases,168.84,3.73408315161301
OFF-ENE-10002104,"Enermax Note Cards, Premium",Office Supplies,Paper,29.91,22.673384341210035
OFF-AP-10002882,"KitchenAid Coffee Grinder, Silver",Office Supplies,Appliances,71.22,45.4250242741089
TEC-EPS-10004558,"Epson Inkjet, Durable",Technology,Machines,306.63,98.8568774882844
FUR-BO-10004075,"Safco Floating Shelf Set, Metal",Furniture,Bookcases,130.8,115.0239669717875
FUR-TA-10002855,Bevis Round Conference Table Top & Single Column Base,Furniture,Tables,146.34,10.196108100623178
TEC-PH-10003357,Grandstream GXP2100 Mainstream Business Phone,Technology,Phones,76.49,40.92633602123318
TEC-PH-10003620,"Apple Signal Booster, Cordless",Technology,Phones,139.5,2.8650750463204395
TEC-AC-10002257,"Enermax Router, Bluetooth",Technology,Accessories,172.22,46.27048462340337
OFF-EN-10000328,"Kraft Business Envelopes, Set of 50",Office Supplies,Envelopes,19.98,7.222066963425102
FUR-TA-10001056,"Barricks Conference Table, Adjustable Height",Furniture,Tables,909.27,652.8821509187277
TEC-PH-10000141,Clearsounds A400,Technology,Phones,65.99,17.1272206276578
FUR-BO-10003543,"Safco Floating Shelf Set, Mobile",Furniture,Bookcases,132.84,3.386406386172488
OFF-BRE-10002706,"Breville Microwave, White",Office Supplies,Appliances,299.85,43.132574642879824
OFF-AP-10004569,"Hoover Coffee Grinder, Red",Office Supplies,Appliances,45.86,15.000246425207129
FUR-CH-10004011,"SAFCO Executive Leather Armchair, Black",Furniture,Chairs,306,28.565151490948608
OFF-AP-10004336,"Conquest 14 Commercial Heavy-Duty Upright Vacuum, Collection System, Accessory Kit",Office Supplies,Appliances,56.96,0.9757309227904943
TEC-CO-10001595,"Brother Copy Machine, Color",Technology,Copiers,175.82,3.214768301762731
FUR-BO-10000668,"Ikea Corner Shelving, Traditional",Furniture,Bookcases,123.06,31.948734464881674
OFF-AP-10004540,"Eureka The Boss Lite 10-Amp Upright Vacuum, Blue",Office Supplies,Appliances,80.16,8.982127975303857
FUR-HON-10002837,"Hon Round Table, with Bottom Storage",Furniture,Tables,515.91,71.15588397333018
OFF-LA-10000707,"Avery Removable Labels, Adjustable",Office Supplies,Labels,8.64,2.9585399629127513
OFF-AR-10004115,"Sanford Markers, Blue",Office Supplies,Art,23.25,12.972768906050312
TEC-AC-10004081,"Logitech Keyboard, Bluetooth",Technology,Accessories,72.45,21.355997488041687
TEC-MA-10003812,"Panasonic Printer, Wireless",Technology,Machines,266.49,55.8578389768274
FUR-TA-10003785,"Hon Round Table, Adjustable Height",Furniture,Tables,345.4,189.2029295853498
OFF-ST-10004191,"Tenex Lockers, Blue",Office Supplies,Storage,204.15,4.209354299941405
OFF-SU-10003632,"Acme Letter Opener, Easy Grip",Office Supplies,Supplies,31.83,6.960033693165795
TEC-LOG-10000368,"Logitech Flash Drive, Programmable",Technology,Accessories,32.01,12.732763694515354
FUR-CH-10001051,"Hon Chairmat, Red",Furniture,Chairs,55.53,32.20932267524525
OFF-AP-10003021,"Breville Stove, White",Office Supplies,Appliances,559.68,328.47288218818295
TEC-PH-10004402,"Cisco Headset, with Caller ID",Technology,Phones,88.44,11.710084406516847
FUR-IKE-10002147,"Ikea Classic Bookcase, Metal",Furniture,Bookcases,411.21,87.117348792565
TEC-AC-10003951,"Logitech Numeric Keypad, USB",Technology,Accessories,46.53,26.68927238818571
OFF-AR-10003336,"Sanford Pencil Sharpener, Easy-Erase",Office Supplies,Art,18.06,4.298558967011331
OFF-GLO-10000491,"GlobeWeis Interoffice Envelope, with clear poly window",Office Supplies,Envelopes,51.36,36.76686200443445
FUR-FU-10001979,Dana Halogen Swing-Arm Architect Lamp,Furniture,Furnishings,40.97,10.548219280878426
TEC-PH-10003813,"Samsung Signal Booster, VoIP",Technology,Phones,136.68,28.834596057622992
TEC-PH-10001284,"Apple Smart Phone, Cordless",Technology,Phones,424.2,217.09041967249505
OFF-BI-10002931,"Avery Trapezoid Extra Heavy Duty 4"" Binders",Office Supplies,Binders,41.94,46.85899745442577
TEC-PH-10001002,"Apple Signal Booster, Full Size",Technology,Phones,137.94,67.30386479578353
FUR-CH-10000155,Global Comet Stacking Armless Chair,Furniture,Chairs,299.05,18.845140589401886
OFF-SU-10003863,"Kleencut Letter Opener, High Speed",Office Supplies,Supplies,26.46,5.330980696848285
TEC-NOK-10001172,"Nokia Speaker Phone, VoIP",Technology,Phones,123.24,28.23776788403747
TEC-NOK-10003034,"Nokia Speaker Phone, Full Size",Technology,Phones,124.44,37.95856362744799
FUR-FU-10003970,"Rubbermaid Clock, Durable",Furniture,Furnishings,47.19,0.17694104891098603
FUR-TA-10004147,Hon 4060 Series Tables,Furniture,Tables,111.96,4.357804866135767
TEC-PH-10004211,"Cisco Headset, Cordless",Technology,Phones,91.29,13.260324623888792
TEC-CO-10001192,"HP Personal Copier, Digital",Technology,Copiers,123.93,11.069833470502429
TEC-AC-10002402,Razer Kraken PRO Over Ear PC and Music Headset,Technology,Accessories,79.99,14.987522857978362
FUR-CH-10004095,"SAFCO Executive Leather Armchair, Adjustable",Furniture,Chairs,309.28,35.77852844471099
OFF-ELD-10003038,"Eldon Shelving, Blue",Office Supplies,Storage,48.42,24.04289434023957
FUR-CH-10001465,"Hon Swivel Stool, Red",Furniture,Chairs,163.65,25.8648798831867
FUR-CH-10000105,"Hon Steel Folding Chair, Set of Two",Furniture,Chairs,83.67,54.01002700691153
FUR-TA-10000245,"Chromcraft Computer Table, Adjustable Height",Furniture,Tables,297.08,151.18874555924668
TEC-MA-10002927,Canon imageCLASS MF7460 Monochrome Digital Laser Multifunction Copier,Technology,Machines,1995.99,360.6436108060884
OFF-PA-10000806,Xerox 1934,Office Supplies,Paper,55.98,12.470673464807849
TEC-MA-10001372,"Konica Card Printer, White",Technology,Machines,173.58,32.21120421291898
OFF-AR-10002975,"Stanley Sketch Pad, Fluorescent",Office Supplies,Art,30.46,9.324728132360214
OFF-AP-10000615,"KitchenAid Toaster, Silver",Office Supplies,Appliances,57.38,30.824485345983497
OFF-AP-10003334,"Cuisinart Coffee Grinder, Silver",Office Supplies,Appliances,39.36,18.549837623063052
FUR-FU-10000541,"Advantus Frame, Duo Pack",Furniture,Furnishings,111.18,8.905042519209031
FUR-FU-10003664,"Electrix Architect's Clamp-On Swing Arm Lamp, Black",Furniture,Furnishings,95.46,16.12958808417776
FUR-CH-10004997,Hon Every-Day Series Multi-Task Chairs,Furniture,Chairs,187.98,9.300519011239732
OFF-PA-10004727,"Eaton Note Cards, 8.5 x 11",Office Supplies,Paper,26.49,8.149436785887865
FUR-BO-10003333,"Sauder Stackable Bookrack, Traditional",Furniture,Bookcases,146.28,31.194676003331736
TEC-AC-10000140,"Enermax Numeric Keypad, Bluetooth",Technology,Accessories,57.54,0.09293525310391193
TEC-MA-10002998,"Okidata Receipt Printer, Durable",Technology,Machines,123.03,0.40733971439022987
TEC-APP-10004049,"Apple Speaker Phone, Cordless",Technology,Phones,126.15,63.80897687802939
FUR-TA-10003786,"Hon Training Table, Fully Assembled",Furniture,Tables,334.17,98.25066360987924
OFF-HON-10004825,"Hon File Folder Labels, Adjustable",Office Supplies,Labels,6.54,3.9492082103361996
FUR-BO-10003028,"Sauder 3-Shelf Cabinet, Mobile",Furniture,Bookcases,169.2,6.067585207285588
FUR-BO-10003734,"Dania Classic Bookcase, Metal",Furniture,Bookcases,410.22,148.70566098677114
OFF-AP-10000975,"KitchenAid Stove, Black",Office Supplies,Appliances,569.58,166.55731075497516
FUR-BO-10002031,"Sauder Classic Bookcase, Pine",Furniture,Bookcases,437.34,41.4927676554551
FUR-TA-10001572,"Hon Wood Table, Rectangular",Furniture,Tables,352.6,113.6914447496869
TEC-MA-10002080,"Epson Printer, Durable",Technology,Machines,175.16,82.01378269899891
TEC-MA-10003314,"Epson Phone, White",Technology,Machines,79.38,4.849601278865937
OFF-AP-10001266,"Hoover Toaster, Black",Office Supplies,Appliances,83.07,9.523414218377528
TEC-AC-10002357,"SanDisk Numeric Keypad, USB",Technology,Accessories,35.44,3.2035914802297922
FUR-TA-10000945,"Bevis Coffee Table, Adjustable Height",Furniture,Tables,213.58,104.09472045595705
OFF-EN-10004526,"GlobeWeis Mailers, Recycled",Office Supplies,Envelopes,37.35,12.411419972385318
OFF-BI-10003917,"Wilson Jones 3-Hole Punch, Recycled",Office Supplies,Binders,28.35,6.243108188803662
FUR-SAF-10002314,"SAFCO Swivel Stool, Black",Furniture,Chairs,165.51,52.28036569940256
TEC-SAM-10000345,"Samsung Audio Dock, with Caller ID",Technology,Phones,166.83,2.3672376078736526
TEC-PH-10004261,"Nokia Signal Booster, Full Size",Technology,Phones,137.79,19.577777905316765
FUR-BO-10004218,"Bush Heritage Pine Collection 5-Shelf Bookcase, Albany Pine Finish, *Special Order",Furniture,Bookcases,140.98,20.064166307411444
FUR-CH-10003697,"Novimex Chairmat, Adjustable",Furniture,Chairs,39.22,8.546794515434051
OFF-AP-10004293,"KitchenAid Refrigerator, Silver",Office Supplies,Appliances,528.69,197.781192938039
TEC-AC-10001114,Microsoft Wireless Mobile Mouse 4000,Technology,Accessories,39.99,2.1600291997862535
FUR-SAF-10002180,"SAFCO Executive Leather Armchair, Red",Furniture,Chairs,461.43,245.5987658100751
FUR-TA-10000671,"Barricks Conference Table, with Bottom Storage",Furniture,Tables,604.72,368.053111863105
OFF-AR-10001606,"BIC Highlighters, Fluorescent",Office Supplies,Art,20.19,4.533691431134036
TEC-CAN-10004354,"Canon Ink, Laser",Technology,Copiers,147.15,9.972122777268602
FUR-FU-10004614,"Rubbermaid Frame, Black",Furniture,Furnishings,109.89,9.031708720390876
TEC-BRO-10000917,"Brother Fax Machine, Digital",Technology,Copiers,318.18,14.516806702290745
OFF-EN-10004053,"GlobeWeis Manila Envelope, with clear poly window",Office Supplies,Envelopes,30.93,3.3680618754165645
OFF-PA-10000659,"TOPS Carbonless Receipt Book, Four 2-3/4 x 7-1/4 Money Receipts per Page",Office Supplies,Paper,17.52,1.2855930580937154
TEC-CO-10003160,"Brother Wireless Fax, Laser",Technology,Copiers,252.54,67.65922449963425
OFF-AP-10001670,"Hoover Coffee Grinder, White",Office Supplies,Appliances,66.93,24.48945967576586
TEC-PH-10001732,"Samsung Audio Dock, Cordless",Technology,Phones,169.68,29.675919538317217
FUR-CH-10000974,"Harbour Creations Executive Leather Armchair, Black",Furniture,Chairs,473.61,19.473173975762343
