product_id,product_name,category,sub_category,price_per_unit,cost_per_unit
OFF-ST-10002395,"Rogers Lockers, Single Width",Office Supplies,Storage,211.65,1.979726934882282
OFF-AR-10001053,"Boston Pencil Sharpener, Easy-Erase",Office Supplies,Art,20.14,3.909275334976301
FUR-TA-10000665,"Bevis Computer Table, Fully Assembled",Furniture,Tables,494.52,37.130180616896254
FUR-FU-10001746,"Advantus Stacking Tray, Durable",Furniture,Furnishings,26.37,7.300057831172904
OFF-STA-10000298,"Stanley Canvas, Blue",Office Supplies,Art,49.47,18.74131884679881
OFF-AR-10001952,"BIC Canvas, Easy-Erase",Office Supplies,Art,53.97,37.96446487701619
FUR-CH-10000333,"SAFCO Swivel Stool, Black",Furniture,Chairs,165.51,28.167442432116598
OFF-ST-10003964,"Fellowes Lockers, Industrial",Office Supplies,Storage,207.81,76.66016356927257
OFF-AP-10000667,"Breville Stove, White",Office Supplies,Appliances,373.12,11.377377191396363
OFF-ST-10000486,"Rogers Trays, Industrial",Office Supplies,Storage,62.16,16.498102385322408
FUR-CH-10004089,"Harbour Creations Bag Chairs, Set of Two",Furniture,Chairs,63.87,16.94087669093866
OFF-BI-10002026,Avery Arch Ring Binders,Office Supplies,Binders,58.1,34.27271390331378
OFF-HAM-10000983,"Hamilton Beach Refrigerator, White",Office Supplies,Appliances,498.27,324.5517898061929
FUR-FU-10003939,"Tenex Photo Frame, Duo Pack",Furniture,Furnishings,51.9,15.66860412392135
OFF-AP-10004041,"KitchenAid Microwave, White",Office Supplies,Appliances,308.46,143.1921025925306
FUR-BO-10004399,"Bush Floating Shelf Set, Pine",Furniture,Bookcases,172.62,12.85940725470261
FUR-CH-10002439,"Iceberg Nesting Folding Chair, 19w x 6d x 43h",Furniture,Chairs,58.22,22.08417870887826
OFF-ST-10001858,"Tenex Shelving, Single Width",Office Supplies,Storage,54.69,32.343919775489354
FUR-FU-10002019,"Eldon Photo Frame, Black",Furniture,Furnishings,58.11,37.52207645792523
OFF-PA-10001661,"SanDisk Computer Printout Paper, 8.5 x 11",Office Supplies,Paper,33.93,12.510585916133127
TEC-AC-10004761,Maxell 4.7GB DVD+RW 3/Pack,Technology,Accessories,15.93,9.453104706663673
TEC-CO-10003574,"Brother Personal Copier, High-Speed",Technology,Copiers,141.09,34.06588887382556
OFF-ST-10000892,"Tenex Trays, Wire Frame",Office Supplies,Storage,53.28,10.608371052037239
OFF-BI-10002562,"Ibico Binding Machine, Durable",Office Supplies,Binders,52.92,4.446965458667377
TEC-CO-10000972,"Sharp Fax and Copier, Digital",Technology,Copiers,168.24,13.773113980647205
OFF-AP-10004756,"Hamilton Beach Toaster, Red",Office Supplies,Appliances,57.51,17.745896987683725
OFF-SU-10000695,"Kleencut Trimmer, Serrated",Office Supplies,Supplies,38.13,11.018084417575903
OFF-KIT-10004515,"KitchenAid Microwave, Red",Office Supplies,Appliances,310.32,155.91631042599298
TEC-CO-10003228,"Hewlett Copy Machine, Laser",Technology,Copiers,263.31,52.826993519805335
TEC-AC-10003571,"Memorex Numeric Keypad, Bluetooth",Technology,Accessories,30.14,5.104266590922751
TEC-CO-10004325,"Canon Personal Copier, Laser",Technology,Copiers,142.74,49.2707905124154
OFF-AR-10004042,"BOSTON Model 1800 Electric Pencil Sharpeners, Putty/Woodgrain",Office Supplies,Art,17.98,3.202697388206987
TEC-CO-10002697,"Brother Wireless Fax, High-Speed",Technology,Copiers,377.01,41.290740255009624
FUR-BUS-10003724,"Bush Corner Shelving, Metal",Furniture,Bookcases,123.45,5.1885618915851115
FUR-BO-10001867,"Dania Corner Shelving, Mobile",Furniture,Bookcases,83.06,18.75302484024704
TEC-PH-10001917,"Motorola Speaker Phone, Full Size",Technology,Phones,87.38,2.2476228755979726
TEC-PH-10002468,"Plantronics CS 50-USB -headset- Convertible, Monaural",Technology,Phones,135.99,3.9608633643581848
OFF-AP-10004183,"Breville Microwave, Red",Office Supplies,Appliances,301.71,79.03122031494382
TEC-CAN-10004839,"Canon Wireless Fax, Color",Technology,Copiers,380.1,2.8761350172211526
FUR-TA-10001228,"Bevis Training Table, Rectangular",Furniture,Tables,332.55,295.8366762105264
FUR-CH-10000013,"Hon Steel Folding Chair, Black",Furniture,Chairs,78.99,16.288812243867547
OFF-AP-10002361,"Hoover Microwave, Red",Office Supplies,Appliances,308.64,58.565219504835405
TEC-APP-10002321,"Apple Signal Booster, Full Size",Technology,Phones,137.94,55.59418048733305
FUR-BO-10003713,"Sauder Corner Shelving, Mobile",Furniture,Bookcases,149.82,151.2840817470754
TEC-PH-10004437,"Cisco Speaker Phone, with Caller ID",Technology,Phones,92.32,11.017061807043437
OFF-PA-10002196,"Green Bar Message Books, Recycled",Office Supplies,Paper,23.7,3.2408980185020817
TEC-AC-10001082,"Enermax Keyboard, Bluetooth",Technology,Accessories,55.64,8.818006266379914
FUR-CH-10001455,"Office Star Swivel Stool, Adjustable",Furniture,Chairs,117.62,35.84287777223675
TEC-SAM-10002496,"Samsung Speaker Phone, VoIP",Technology,Phones,123.33,80.42519880051265
TEC-CO-10003561,"Sharp Copy Machine, Color",Technology,Copiers,237.6,83.47135716293903
TEC-CO-10000013,"Brother Fax Machine, Laser",Technology,Copiers,318.54,42.896224320477806
TEC-KON-10000302,"Konica Phone, White",Technology,Machines,84.6,45.535112388715085
FUR-TA-10001433,"Barricks Coffee Table, Adjustable Height",Furniture,Tables,303.69,167.82207117961653
OFF-ST-10002554,Tennsco Industrial Shelving,Office Supplies,Storage,48.91,11.594304966749638
OFF-AP-10000228,"Cuisinart Blender, White",Office Supplies,Appliances,65.13,15.27970203507112
TEC-PH-10003652,"Motorola Headset, Cordless",Technology,Phones,82.59,45.38184101006623
TEC-CO-10003506,"HP Fax Machine, Laser",Technology,Copiers,299.94,39.197137067389406
TEC-CO-10004398,"Brother Copy Machine, Color",Technology,Copiers,173.66,35.186391912054646
OFF-AP-10002963,"Hoover Toaster, Red",Office Supplies,Appliances,83.64,5.088967515372165
TEC-CO-10003471,"Hewlett Fax and Copier, Color",Technology,Copiers,194.31,126.02202078138225
TEC-CO-10000266,"Canon Copy Machine, Color",Technology,Copiers,175.72,4.155896823637398
OFF-LA-10002609,"Avery Color Coded Labels, Alphabetical",Office Supplies,Labels,8.74,2.698533418948685
OFF-AP-10000639,"Breville Microwave, Red",Office Supplies,Appliances,201.14,54.929322131432
FUR-CH-10003973,GuestStacker Chair with Chrome Finish Legs,Furniture,Chairs,371.76,53.450391726495916
TEC-AC-10003911,NETGEAR AC1750 Dual Band GigabitSmart WiFi Router,Technology,Accessories,159.99,26.55054499972172
TEC-CO-10003002,"Canon Personal Copier, Digital",Technology,Copiers,94.92,37.56641167952888
OFF-TEN-10004270,"Tenex File Cart, Single Width",Office Supplies,Storage,134.16,31.981883656511346
TEC-STA-10002650,"StarTech Card Printer, Wireless",Technology,Machines,163.5,22.02240355268343
TEC-MA-10003461,"Epson Calculator, Red",Technology,Machines,43.56,9.163689124879474
FUR-CH-10001237,"Hon Swivel Stool, Black",Furniture,Chairs,161.22,10.925847643856805
OFF-AR-10003457,"Sanford Sketch Pad, Water Color",Office Supplies,Art,48.66,17.01826870382343
TEC-CO-10001371,"Sharp Fax and Copier, Laser",Technology,Copiers,112.4,81.29002840751603
TEC-PH-10002660,Nortel Networks T7316 E Nt8 B27,Technology,Phones,67.99,1.745128702850825
TEC-AC-10003469,"SanDisk Router, USB",Technology,Accessories,256.56,37.236050005413475
TEC-PH-10004450,"Cisco Office Telephone, Full Size",Technology,Phones,81.75,5.852906764929163
OFF-BI-10002867,GBC Recycled Regency Composition Covers,Office Supplies,Binders,59.78,31.05765038209184
OFF-AP-10000275,"Sanyo Counter Height Refrigerator with Crisper, 3.6 Cubic Foot, Stainless Steel/Black",Office Supplies,Appliances,328.14,77.51391625571478
TEC-PH-10000019,"Motorola Audio Dock, Full Size",Technology,Phones,174.66,132.12134364858028
OFF-AP-10000119,"Breville Microwave, White",Office Supplies,Appliances,199.9,67.67458455252881
OFF-TEN-10001160,"Tenex Trays, Industrial",Office Supplies,Storage,54.69,4.157802230797714
TEC-CO-10004078,"Sharp Fax Machine, Laser",Technology,Copiers,295.65,2.538369878503911
TEC-MA-10000606,"Okidata Printer, White",Technology,Machines,266.91,61.214119843049446
TEC-CIS-10002153,"Cisco Audio Dock, Cordless",Technology,Phones,184.92,9.824712992885695
TEC-CO-10004468,"Canon Copy Machine, Digital",Technology,Copiers,174.52,16.30392887088769
FUR-NOV-10000847,"Novimex Executive Leather Armchair, Adjustable",Furniture,Chairs,455.52,21.78249206679429
OFF-EN-10003498,"Cameo Interoffice Envelope, Recycled",Office Supplies,Envelopes,46.23,12.761115602869431
FUR-BO-10003103,"Dania Floating Shelf Set, Pine",Furniture,Bookcases,113.8,14.351456129373583
FUR-CH-10003249,"Novimex Chairmat, Adjustable",Furniture,Chairs,58.83,1.3718913977216287
FUR-BO-10001392,"Sauder Classic Bookcase, Traditional",Furniture,Bookcases,435.99,136.13158177834592
TEC-MA-10004693,"Panasonic Calculator, White",Technology,Machines,48.69,42.32918570046323
TEC-PH-10001128,Motorola Droid Maxx,Technology,Phones,149.99,23.664983165839637
OFF-AP-10000775,"Breville Blender, Silver",Office Supplies,Appliances,90.24,13.124561686895541
TEC-AC-10003690,"Logitech Numeric Keypad, USB",Technology,Accessories,31.02,28.42097421824677
TEC-MA-10000418,Cubify CubeX 3D Printer Double Head Print,Technology,Machines,2999.99,1911.4849491954124
OFF-EN-10003286,Staples,Office Supplies,Envelopes,8.28,0.34975386546245263
TEC-STA-10003550,"StarTech Card Printer, Red",Technology,Machines,160.65,128.5210058988382
OFF-ST-10000695,"Rogers Lockers, Wire Frame",Office Supplies,Storage,210.69,20.87983183902975
OFF-AP-10001630,"Hamilton Beach Microwave, Black",Office Supplies,Appliances,187.96,88.2749335447693
TEC-PH-10000693,"Apple Speaker Phone, with Caller ID",Technology,Phones,82.2,2.9380808368306095
TEC-PH-10002672,"Cisco Smart Phone, Full Size",Technology,Phones,434.26,193.49808644888566
TEC-AC-10004566,"Belkin Mouse, USB",Technology,Accessories,40.92,7.4667708287403896
OFF-AR-10002605,"Sanford Sketch Pad, Fluorescent",Office Supplies,Art,31.16,16.77531139143761
FUR-FU-10001366,"Advantus Photo Frame, Duo Pack",Furniture,Furnishings,53.04,25.837170488046183
OFF-ST-10002105,"Smead Trays, Wire Frame",Office Supplies,Storage,31.7,24.133312377203204
TEC-CO-10000660,"Hewlett Copy Machine, Color",Technology,Copiers,261.87,26.83807554681846
OFF-ST-10000624,"Eldon File Cart, Single Width",Office Supplies,Storage,128.37,9.39381179917138
TEC-PAN-10000377,"Panasonic Inkjet, Durable",Technology,Machines,312.21,4.423202671565659
TEC-CO-10004267,"Brother Ink, Laser",Technology,Copiers,147.3,40.15856311914234
FUR-TA-10003715,Hon 2111 Invitation Series Corner Table,Furniture,Tables,209.37,98.81676273048201
TEC-PH-10000087,"Apple Signal Booster, Cordless",Technology,Phones,93,8.50344483549922
OFF-AR-10002714,"Stanley Sketch Pad, Easy-Erase",Office Supplies,Art,44.7,27.80204780565663
OFF-AP-10004415,"Hoover Microwave, Red",Office Supplies,Appliances,205.76,148.75734469939712
FUR-CH-10001914,"Harbour Creations Bag Chairs, Black",Furniture,Chairs,39.46,8.81660109533506
OFF-AP-10001510,"Cuisinart Microwave, Silver",Office Supplies,Appliances,279.21,240.2340582929213
OFF-AR-10002458,"Stanley Canvas, Easy-Erase",Office Supplies,Art,49.74,10.204983670762322
TEC-MA-10002520,"Panasonic Receipt Printer, White",Technology,Machines,119.31,22.8486658972762
OFF-ST-10002659,"Smead Shelving, Wire Frame",Office Supplies,Storage,48,6.796773281353926
TEC-PH-10002115,Plantronics 81402,Technology,Phones,65.99,37.308924477613104
TEC-AC-10000170,"Memorex Keyboard, Programmable",Technology,Accessories,72.84,12.29070758136973
OFF-ST-10003256,"Eldon Shelving, Wire Frame",Office Supplies,Storage,47.49,25.525277680561864
TEC-AC-10004114,KeyTronic6101 Series -Keyboard- Black,Technology,Accessories,40.99,14.344739383129365
FUR-TA-10000347,"Hon Computer Table, Adjustable Height",Furniture,Tables,489.81,446.57166971765133
OFF-ROG-10002132,"Rogers Lockers, Industrial",Office Supplies,Storage,212.1,15.51126748084597
FUR-CH-10004086,Hon 4070 Series Pagoda Armless Upholstered Stacking Chairs,Furniture,Chairs,291.73,35.40041903788646
TEC-PH-10003491,"Samsung Office Telephone, Full Size",Technology,Phones,66.51,22.316038105525923
FUR-CH-10000430,"SAFCO Swivel Stool, Red",Furniture,Chairs,167.94,18.557043018028136
FUR-FU-10003664,"Tenex Frame, Erganomic",Furniture,Furnishings,108.6,46.665851578153536
OFF-SU-10003789,"Fiskars Box Cutter, Steel",Office Supplies,Supplies,34.92,19.482900634225242
TEC-MA-10000473,"Konica Phone, Red",Technology,Machines,83.34,8.759251452265616
TEC-PH-10001805,"Nokia Speaker Phone, Full Size",Technology,Phones,124.44,29.92642358503947
OFF-CAM-10004271,"Cameo Mailers, Recycled",Office Supplies,Envelopes,36.96,2.170846546673007
TEC-CO-10001756,"Canon Personal Copier, Color",Technology,Copiers,96.12,56.87956395698305
FUR-CH-10001553,"Hon Bag Chairs, Adjustable",Furniture,Chairs,47.64,21.09081512831264
TEC-PH-10002572,"Nokia Audio Dock, Cordless",Technology,Phones,113.06,6.637934268475489
FUR-BO-10000021,"Dania Corner Shelving, Metal",Furniture,Bookcases,121.53,30.044761050343887
TEC-PH-10004242,"Apple Speaker Phone, VoIP",Technology,Phones,82.26,8.03202160239079
FUR-CH-10003282,"SAFCO Bag Chairs, Black",Furniture,Chairs,47.01,20.55433190909719
TEC-MA-10000003,"Konica Phone, Durable",Technology,Machines,86.31,7.498996420171801
TEC-MA-10004168,"Panasonic Card Printer, Wireless",Technology,Machines,173.82,90.92517968207457
TEC-PH-10004601,"Nokia Audio Dock, with Caller ID",Technology,Phones,166.74,9.393948291674171
FUR-BO-10004806,"Safco Corner Shelving, Traditional",Furniture,Bookcases,149.46,0.7765622232097292
TEC-MA-10004603,"Okidata Printer, Durable",Technology,Machines,268.62,23.69859796493043
TEC-SAN-10004424,"SanDisk Router, Bluetooth",Technology,Accessories,256.35,68.47882965698766
FUR-FU-10000889,"Rubbermaid Clock, Black",Furniture,Furnishings,50.16,0.6265146237261479
OFF-ST-10000423,"Rogers Trays, Blue",Office Supplies,Storage,41.12,25.45811344141006
FUR-LES-10002852,"Lesro Computer Table, Adjustable Height",Furniture,Tables,425.91,83.8523526529721
FUR-TA-10002356,Bevis Boat-Shaped Conference Table,Furniture,Tables,262.11,84.10846342838171
FUR-LES-10004420,"Lesro Coffee Table, with Bottom Storage",Furniture,Tables,252,4.86656880904166
FUR-DEF-10000065,"Deflect-O Frame, Durable",Furniture,Furnishings,107.07,7.031189191384898
FUR-BO-10001668,"Ikea Floating Shelf Set, Pine",Furniture,Bookcases,171.69,46.17855742504097
TEC-CO-10004901,"HP Fax and Copier, Laser",Technology,Copiers,115.26,59.04464728538984
TEC-CO-10002035,"Canon Wireless Fax, High-Speed",Technology,Copiers,376.86,111.40102461475
TEC-AC-10004317,"SanDisk Numeric Keypad, USB",Technology,Accessories,53.16,1.3051319518033844
OFF-BI-10000341,"Ibico Binding Machine, Recycled",Office Supplies,Binders,51.78,7.089704584082876
TEC-SAM-10000613,"Samsung Speaker Phone, with Caller ID",Technology,Phones,123.24,12.837218194838501
TEC-MA-10000555,"Panasonic Card Printer, Red",Technology,Machines,170.97,29.643680564708614
OFF-ST-10000003,"Tenex Shelving, Industrial",Office Supplies,Storage,55.14,14.464141651258393
TEC-CO-10004981,"Sharp Personal Copier, Laser",Technology,Copiers,80,56.80993121266987
FUR-SAF-10004525,"SAFCO Swivel Stool, Red",Furniture,Chairs,167.94,48.12093697775103
OFF-EN-10004981,"Ames Interoffice Envelope, with clear poly window",Office Supplies,Envelopes,48.66,9.612208917802384
FUR-BO-10004441,"Ikea Library with Doors, Metal",Furniture,Bookcases,241.9,50.10715718817182
OFF-SU-10003229,"Stiletto Trimmer, Easy Grip",Office Supplies,Supplies,44.37,6.715978861512498
TEC-MA-10004613,"Okidata Phone, White",Technology,Machines,85.26,2.8530265960562256
OFF-AP-10003099,"Eureka Hand Vacuum, Bagless",Office Supplies,Appliances,49.43,9.811986076438957
FUR-BO-10000425,"Bush Floating Shelf Set, Traditional",Furniture,Bookcases,171.27,69.02925108002118
FUR-BO-10001608,"Hon Metal Bookcases, Black",Furniture,Bookcases,70.98,29.06374676107245
FUR-TA-10002827,"Hon Computer Table, Fully Assembled",Furniture,Tables,329.14,7.30290182556859
OFF-ST-10000632,"Rogers Shelving, Single Width",Office Supplies,Storage,62.16,41.81087176420124
FUR-TA-10001833,"Bevis Round Table, Fully Assembled",Furniture,Tables,519.66,58.92109742985203
FUR-FU-10002937,"GE 48"" Fluorescent Tube, Cool White Energy Saver, 34 Watts, 30/Box",Furniture,Furnishings,99.23,5.719253670651739
TEC-CIS-10002344,"Cisco Smart Phone, Full Size",Technology,Phones,651.39,126.30967692095054
FUR-CH-10000994,"Harbour Creations Rocking Chair, Black",Furniture,Chairs,144.66,20.28430542148075
FUR-TA-10001359,"Chromcraft Training Table, with Bottom Storage",Furniture,Tables,283.89,391.4562079933157
TEC-PH-10000026,"Nokia Office Telephone, Cordless",Technology,Phones,67.98,13.40406980489963
TEC-PH-10004085,"Apple Audio Dock, with Caller ID",Technology,Phones,166.89,6.610847408229801
FUR-FU-10003052,"Advantus Photo Frame, Duo Pack",Furniture,Furnishings,53.04,27.543915318435854
OFF-AR-10001228,"Stanley Markers, Water Color",Office Supplies,Art,25.38,1.530826586462617
FUR-BO-10004541,"Dania Library with Doors, Mobile",Furniture,Bookcases,364.92,102.35570616450173
FUR-FU-10001290,Executive Impressions Supervisor Wall Clock,Furniture,Furnishings,42.1,10.994218245907408
TEC-PH-10003012,Nortel Meridian M3904 Professional Digital phone,Technology,Phones,153.99,6.9212317852165866
OFF-SU-10002379,"Fiskars Letter Opener, High Speed",Office Supplies,Supplies,27.33,10.265332981975495
OFF-EN-10003000,"Cameo Mailers, Recycled",Office Supplies,Envelopes,36.96,1.8067546515138175
TEC-EPS-10002711,"Epson Card Printer, Red",Technology,Machines,167.1,51.971493597670694
OFF-PA-10000579,"Xerox Computer Printout Paper, Recycled",Office Supplies,Paper,26.25,1.3645577478491473
OFF-EN-10004941,"GlobeWeis Manila Envelope, Recycled",Office Supplies,Envelopes,26.19,6.811637663757323
FUR-FU-10004460,"Howard Miller 12"" Round Wall Clock",Furniture,Furnishings,39.29,9.64278448272118
TEC-MOT-10003050,"Motorola Smart Phone, Cordless",Technology,Phones,642.78,32.90658289888836
FUR-TA-10001205,"Chromcraft Wood Table, Rectangular",Furniture,Tables,480.09,282.1676435425448
OFF-AP-10003497,"KitchenAid Microwave, Red",Office Supplies,Appliances,310.32,138.54212539
FUR-BO-10004340,"Safco Classic Bookcase, Mobile",Furniture,Bookcases,293.78,11.031226974563019
FUR-CH-10002317,Global Enterprise Series Seating Low-Back Swivel/Tilt Chairs,Furniture,Chairs,258.98,46.356367799991055
TEC-PH-10000720,"Samsung Audio Dock, Full Size",Technology,Phones,168.12,14.689407469836945
OFF-ST-10004489,"Smead Lockers, Single Width",Office Supplies,Storage,198.45,10.038279009269745
FUR-CH-10000583,"Novimex Swivel Stool, Set of Two",Furniture,Chairs,166.71,63.81831054619562
FUR-IKE-10000649,"Ikea Library with Doors, Pine",Furniture,Bookcases,364.74,98.14940425920457
OFF-TEN-10003148,"Tenex Lockers, Single Width",Office Supplies,Storage,204.18,83.68674586376247
FUR-BO-10004508,"Ikea Floating Shelf Set, Mobile",Furniture,Bookcases,115.24,35.84113325036411
FUR-CH-10004910,"Office Star Executive Leather Armchair, Red",Furniture,Chairs,469.68,204.5237046907146
FUR-TA-10003591,"Bevis Wood Table, Rectangular",Furniture,Tables,531.18,314.4542325562409
TEC-MA-10002931,"Okidata Calculator, Durable",Technology,Machines,52.41,18.828774048007027
TEC-PH-10001304,"Apple Office Telephone, Cordless",Technology,Phones,45.42,11.62920782141346
OFF-HAM-10003040,"Hamilton Beach Stove, White",Office Supplies,Appliances,540.48,522.197954120448
FUR-BO-10002378,"Dania 3-Shelf Cabinet, Metal",Furniture,Bookcases,93.94,16.19488835941069
TEC-AC-10003832,LogitechP710e Mobile Speakerphone,Technology,Accessories,257.49,67.4711630434414
TEC-PH-10003486,"Apple Audio Dock, Cordless",Technology,Phones,113.16,35.56373061917048
FUR-BO-10003660,"Bush Cubix Collection Bookcases, Fully Assembled",Furniture,Bookcases,220.98,106.1575440139538
TEC-MA-10001047,"3D Systems Cube Printer, 2nd Generation, Magenta",Technology,Machines,1299.99,58.39932961296769
FUR-BO-10002889,"Dania Stackable Bookrack, Pine",Furniture,Bookcases,124.11,41.82454407275993
FUR-CH-10001675,"Office Star Steel Folding Chair, Adjustable",Furniture,Chairs,62.8,1.5103872122919626
FUR-FU-10001674,"Deflect-O Clock, Duo Pack",Furniture,Furnishings,50.37,14.483602124225035
TEC-CO-10002326,"Canon Copy Machine, Color",Technology,Copiers,263.58,32.42647361887715
OFF-EN-10003936,"Cameo Peel and Seal, with clear poly window",Office Supplies,Envelopes,24.54,5.099122151070289
FUR-TA-10004440,"Chromcraft Wood Table, Fully Assembled",Furniture,Tables,322.66,106.71681144678782
FUR-CH-10003941,"Novimex Executive Leather Armchair, Adjustable",Furniture,Chairs,303.68,38.12255614234512
OFF-AR-10003554,"Stanley Canvas, Blue",Office Supplies,Art,49.47,31.13430854158858
OFF-BRE-10003558,"Breville Refrigerator, White",Office Supplies,Appliances,517.47,33.75036056155802
OFF-AP-10003590,"KitchenAid Refrigerator, Black",Office Supplies,Appliances,527.37,206.56815394583916
FUR-TA-10000687,"Bevis Conference Table, with Bottom Storage",Furniture,Tables,923.76,270.37511711533136
TEC-CO-10003784,"HP Fax Machine, Laser",Technology,Copiers,199.96,12.532757244402971
FUR-HAR-10003124,"Harbour Creations Chairmat, Red",Furniture,Chairs,72,24.999791325070117
OFF-BI-10004330,"GBC Velobind Prepunched Cover Sets, Regency Series",Office Supplies,Binders,36.98,0.15046587413791965
OFF-BI-10004001,GBC Recycled VeloBinder Covers,Office Supplies,Binders,17.04,9.191229949062796
FUR-TA-10000490,"Lesro Training Table, with Bottom Storage",Furniture,Tables,268.8,20.33848948023756
FUR-BO-10001541,"Bush Stackable Bookrack, Traditional",Furniture,Bookcases,122.97,25.521539887918014
FUR-HON-10000224,"Hon Computer Table, with Bottom Storage",Furniture,Tables,494.43,84.57639832475908
OFF-ST-10003997,"Fellowes File Cart, Industrial",Office Supplies,Storage,91.86,4.431886369669313
FUR-BO-10000022,"Dania Floating Shelf Set, Traditional",Furniture,Bookcases,169.35,42.17582817380352
FUR-OFF-10002542,"Office Star Executive Leather Armchair, Adjustable",Furniture,Chairs,469.92,57.40254962395603
OFF-AP-10002312,"KitchenAid Refrigerator, Black",Office Supplies,Appliances,527.37,22.324245390430193
TEC-AC-10002158,"Enermax Memory Card, Erganomic",Technology,Accessories,112.2,45.68870969293249
TEC-ENE-10000995,"Enermax Memory Card, USB",Technology,Accessories,114.6,66.8038207474225
OFF-AR-10001897,Model L Table or Wall-Mount Pencil Sharpener,Office Supplies,Art,17.99,9.1296965380867
FUR-TA-10001360,"Bevis Round Table, Rectangular",Furniture,Tables,515.76,26.06238963228871
FUR-BAR-10000946,"Barricks Computer Table, with Bottom Storage",Furniture,Tables,480.03,89.54261048351567
OFF-ST-10001173,"Eldon Folders, Industrial",Office Supplies,Storage,17.46,7.868919883378796
OFF-AR-10002538,"Binney & Smith Sketch Pad, Fluorescent",Office Supplies,Art,31.72,14.500399066463464
FUR-FU-10002549,"Deflect-O Clock, Duo Pack",Furniture,Furnishings,50.37,40.05740381719101
TEC-PH-10001424,"Nokia Signal Booster, Full Size",Technology,Phones,91.86,47.85917413603437
FUR-BO-10001039,"Dania Classic Bookcase, Traditional",Furniture,Bookcases,410.76,27.06442801799775
FUR-CH-10004790,"Office Star Bag Chairs, Black",Furniture,Chairs,53.01,26.834355965677876
OFF-AP-10004512,"Hoover Stove, Red",Office Supplies,Appliances,568.47,21.416716831885566
OFF-AP-10000263,"KitchenAid Microwave, Silver",Office Supplies,Appliances,311.07,8.75264093193878
FUR-BO-10001362,"Ikea Classic Bookcase, Metal",Furniture,Bookcases,411.21,314.1956072947097
OFF-SU-10003357,"Fiskars Shears, Steel",Office Supplies,Supplies,47.04,3.7899519671741624
FUR-SAF-10003469,"Safco Classic Bookcase, Traditional",Furniture,Bookcases,438.15,199.4198364787287
OFF-STO-10001791,"Stockwell Clamps, Bulk Pack",Office Supplies,Fasteners,19.23,7.730931802424461
TEC-PH-10002645,"Motorola Signal Booster, with Caller ID",Technology,Phones,143.13,74.0709103286917
FUR-CH-10004199,"SAFCO Executive Leather Armchair, Adjustable",Furniture,Chairs,463.92,380.51401533352475
TEC-AC-10004108,"Memorex Router, USB",Technology,Accessories,246.42,22.00088302554045
FUR-OFF-10004214,"Office Star Executive Leather Armchair, Red",Furniture,Chairs,469.68,203.63938955513692
OFF-AP-10003380,"KitchenAid Coffee Grinder, Black",Office Supplies,Appliances,69.9,34.83024492731757
TEC-AC-10001990,"Enermax Router, USB",Technology,Accessories,172.36,33.20113950587044
FUR-CH-10003910,"Harbour Creations Chairmat, Adjustable",Furniture,Chairs,74.49,7.986831018064462
FUR-SAU-10001776,"Sauder Stackable Bookrack, Pine",Furniture,Bookcases,148.17,13.328138873995698
OFF-AR-10001533,"Sanford Sketch Pad, Easy-Erase",Office Supplies,Art,45.75,6.105983047937759
TEC-MA-10001403,"Panasonic Calculator, White",Technology,Machines,32.46,20.007946413649023
TEC-CIS-10003017,"Cisco Signal Booster, with Caller ID",Technology,Phones,151.83,4.189628135486269
FUR-BO-10001390,"Bush Floating Shelf Set, Traditional",Furniture,Bookcases,114.18,7.543048531035437
OFF-BI-10000561,"Acco Binding Machine, Durable",Office Supplies,Binders,52.59,13.762830427802356
TEC-PH-10003683,"Motorola Audio Dock, VoIP",Technology,Phones,173.46,0.33190351069923246
TEC-MA-10004772,"Konica Inkjet, White",Technology,Machines,310.59,26.22428242384388
OFF-EN-10002723,"Cameo Interoffice Envelope, with clear poly window",Office Supplies,Envelopes,50.97,24.342461443149357
OFF-ST-10002822,"Tenex File Cart, Blue",Office Supplies,Storage,88.8,58.4831360014444
TEC-MOT-10002560,"Motorola Signal Booster, Full Size",Technology,Phones,144.42,114.83697213611283
TEC-PH-10001363,Apple iPhone 5S,Technology,Phones,569.99,70.59930251911275
OFF-ST-10002834,"Smead File Cart, Single Width",Office Supplies,Storage,128.88,39.664833495085695
FUR-CH-10003822,"SAFCO Steel Folding Chair, Adjustable",Furniture,Chairs,88.2,3.474885660819509
FUR-BO-10001337,O'Sullivan Living Dimensions 2-Shelf Bookcases,Furniture,Bookcases,120.98,4.816840775492509
FUR-FU-10001718,"Eldon Door Stop, Duo Pack",Furniture,Furnishings,50.22,30.564283485111254
OFF-PA-10002811,"Green Bar Message Books, 8.5 x 11",Office Supplies,Paper,27.93,24.499948215348265
FUR-FU-10000705,"Advantus Frame, Black",Furniture,Furnishings,74.08,41.25317129339452
FUR-CH-10001204,"Harbour Creations Steel Folding Chair, Red",Furniture,Chairs,97.89,28.255032371170163
