product_id,product_name,category,sub_category,price_per_unit,cost_per_unit
OFF-FA-10003727,"OIC Rubber Bands, Assorted Sizes",Office Supplies,Fasteners,14.52,1.9916912131607467
FUR-ADV-10002889,"Advantus Clock, Durable",Furniture,Furnishings,48.42,10.206659524628819
FUR-BO-10004648,"Sauder Library with Doors, Pine",Furniture,Bookcases,388.98,24.1674622606268
OFF-SU-10003234,"Acme Box Cutter, Easy Grip",Office Supplies,Supplies,39.42,14.839534444335849
FUR-CH-10003842,"Harbour Creations Chairmat, Red",Furniture,Chairs,72,14.393364191063931
TEC-MA-10002134,"Konica Inkjet, Wireless",Technology,Machines,313.44,72.39113201070492
FUR-SAU-10004053,"Sauder Floating Shelf Set, Mobile",Furniture,Bookcases,197.1,35.32758193048838
OFF-AP-10000691,"Cuisinart Refrigerator, Red",Office Supplies,Appliances,496.08,263.74210471089344
TEC-AC-10003408,"Enermax Keyboard, Programmable",Technology,Accessories,84.96,22.481250418469745
TEC-CO-10000344,"Hewlett Copy Machine, Color",Technology,Copiers,174.58,17.58743842643855
FUR-IKE-10003642,"Ikea 3-Shelf Cabinet, Pine",Furniture,Bookcases,143.79,119.3586818009672
OFF-AP-10000226,"Hoover Coffee Grinder, Black",Office Supplies,Appliances,68.22,4.476701204391093
OFF-PA-10002043,"SanDisk Cards & Envelopes, 8.5 x 11",Office Supplies,Paper,52.56,6.6659732466964146
TEC-MA-10002316,"Konica Printer, Durable",Technology,Machines,267.96,35.57031075972026
FUR-TA-10002093,"Chromcraft Wood Table, Adjustable Height",Furniture,Tables,323.14,187.19687402270404
OFF-ST-10004123,Safco Industrial Wire Shelving System,Office Supplies,Storage,90.98,44.78621321418014
FUR-BO-10000746,"Ikea Corner Shelving, Mobile",Furniture,Bookcases,83.72,25.76788376817375
OFF-AP-10000326,Belkin 7 Outlet SurgeMaster Surge Protector with Phone Protection,Office Supplies,Appliances,39.48,27.50353491796841
OFF-BRE-10001197,"Breville Refrigerator, Black",Office Supplies,Appliances,518.76,30.539429302536455
FUR-BO-10001888,"Dania Floating Shelf Set, Pine",Furniture,Bookcases,170.7,75.55657782567638
FUR-FU-10002557,"Rubbermaid Stacking Tray, Erganomic",Furniture,Furnishings,22.17,5.4468912256128466
FUR-FU-10004864,"Howard Miller 14-1/2"" Diameter Chrome Round Wall Clock",Furniture,Furnishings,63.94,1.5278781990216987
FUR-CH-10001423,"Harbour Creations Rocking Chair, Black",Furniture,Chairs,96.44,6.198979227970329
TEC-PH-10003312,"Cisco Office Telephone, VoIP",Technology,Phones,53.7,13.912231396254993
TEC-SAN-10000250,"SanDisk Memory Card, USB",Technology,Accessories,112.62,32.783146261994666
TEC-AC-10002719,"Enermax Router, Programmable",Technology,Accessories,259.83,33.37556457288852
TEC-PH-10004434,Cisco IPPhone7961G VoIPphone- Dark gray,Technology,Phones,135.95,69.69127762975013
FUR-TA-10003627,"Bevis Conference Table, with Bottom Storage",Furniture,Tables,923.76,425.68010890200355
FUR-CH-10000694,"Novimex Steel Folding Chair, Red",Furniture,Chairs,82.23,34.444195352135566
FUR-FU-10000140,"Advantus Clock, Black",Furniture,Furnishings,34.26,5.492030722952338
OFF-AP-10002476,"Cuisinart Blender, Red",Office Supplies,Appliances,66.99,10.268638715345897
FUR-CH-10000229,Global Enterprise Series Seating High-Back Swivel/Tilt Chairs,Furniture,Chairs,270.98,40.581632100612886
OFF-PA-10002923,Xerox 1942,Office Supplies,Paper,48.94,16.057117165077546
FUR-CH-10000788,"Hon Rocking Chair, Adjustable",Furniture,Chairs,88.74,3.3808348551808733
TEC-MA-10003349,"Panasonic Calculator, Wireless",Technology,Machines,50.28,27.82443510856735
TEC-SHA-10000052,"Sharp Copy Machine, Color",Technology,Copiers,240.84,41.82478490071485
TEC-PH-10000705,"Apple Headset, Cordless",Technology,Phones,76.11,5.195650425966998
TEC-CO-10004202,Brother DCP1000 Digital 3 in 1 Multifunction Machine,Technology,Copiers,299.99,22.10130689462364
TEC-CO-10000775,"Sharp Fax and Copier, Laser",Technology,Copiers,168.6,10.038285977617374
OFF-BOS-10001511,"Boston Canvas, Fluorescent",Office Supplies,Art,54.9,41.01122282946587
TEC-MA-10003441,"Okidata Inkjet, Wireless",Technology,Machines,314.1,25.05848426591265
OFF-ST-10004180,Safco Commercial Shelving,Office Supplies,Storage,46.51,21.41172580869616
FUR-BO-10000517,"Ikea Stackable Bookrack, Metal",Furniture,Bookcases,81.36,73.80486659929262
TEC-AC-10003776,"Belkin Flash Drive, Programmable",Technology,Accessories,43.44,39.75623236906087
FUR-SAF-10000085,"Safco Library with Doors, Pine",Furniture,Bookcases,391.14,22.499478618711926
FUR-CH-10002247,"Hon Executive Leather Armchair, Adjustable",Furniture,Chairs,459.63,11.908783684110093
TEC-AC-10003103,"SanDisk Keyboard, Erganomic",Technology,Accessories,79.29,57.70557343599446
FUR-CH-10003733,"Hon Steel Folding Chair, Set of Two",Furniture,Chairs,55.78,7.3784341566195915
FUR-CH-10003168,"Office Star Swivel Stool, Set of Two",Furniture,Chairs,176.19,134.6561578774198
OFF-ST-10001496,Standard Rollaway File with Lock,Office Supplies,Storage,180.19,5.756040767404791
TEC-AC-10001355,"Memorex Router, Programmable",Technology,Accessories,165.14,26.632984803107863
FUR-TA-10000226,"Chromcraft Conference Table, with Bottom Storage",Furniture,Tables,872.67,46.7505149134949
FUR-CH-10003379,Global Commerce Series High-Back Swivel/Tilt Chairs,Furniture,Chairs,284.98,33.13671718953269
TEC-MA-10000559,"Epson Card Printer, Red",Technology,Machines,167.1,62.4356316330215
FUR-BO-10000112,"Dania Corner Shelving, Pine",Furniture,Bookcases,123.42,22.070684074293407
OFF-AR-10002805,"Boston Sketch Pad, Blue",Office Supplies,Art,48.6,0.8699083620034775
FUR-CH-10001039,"Harbour Creations Rocking Chair, Adjustable",Furniture,Chairs,149.58,10.452046091370905
TEC-AC-10001990,Kensington Orbit Wireless Mobile Trackball for PC and Mac,Technology,Accessories,59.99,6.873357928064189
FUR-BO-10004852,"Sauder Classic Bookcase, Traditional",Furniture,Bookcases,435.99,92.62771686654916
TEC-MA-10002148,"Epson Printer, Durable",Technology,Machines,262.74,40.52406735659488
OFF-ST-10001648,"Tenex Shelving, Blue",Office Supplies,Storage,54.66,13.530177367242432
TEC-PH-10004912,Cisco SPA112 2 Port Phone Adapter,Technology,Phones,54.95,9.102835231539483
TEC-CIS-10001938,"Cisco Audio Dock, VoIP",Technology,Phones,182.16,20.851242787777807
OFF-AP-10001154,Bionaire Personal Warm Mist Humidifier/Vaporizer,Office Supplies,Appliances,46.89,17.708644551520724
OFF-ST-10004482,"Rogers Shelving, Industrial",Office Supplies,Storage,62.61,41.59131586522814
OFF-LA-10003923,Alphabetical Labels for Top Tab Filing,Office Supplies,Labels,14.8,0.2211994059204656
OFF-SU-10000596,"Stiletto Trimmer, Steel",Office Supplies,Supplies,42.15,17.720788884680292
OFF-EN-10003859,"Jiffy Interoffice Envelope, with clear poly window",Office Supplies,Envelopes,33.32,2.5102665781308615
OFF-BI-10001645,"Ibico Binding Machine, Recycled",Office Supplies,Binders,51.78,2.9078020591021145
TEC-HP -10004149,"HP Copy Machine, Color",Technology,Copiers,241.89,28.890450679907516
FUR-CH-10003365,"Office Star Executive Leather Armchair, Adjustable",Furniture,Chairs,465,36.59251651985044
TEC-BRO-10003986,"Brother Personal Copier, Color",Technology,Copiers,144.33,40.22800731958154
FUR-TA-10001968,"Bevis Computer Table, with Bottom Storage",Furniture,Tables,496.71,397.7148517762716
FUR-FU-10000361,"Deflect-O Photo Frame, Erganomic",Furniture,Furnishings,50.52,16.046503963273096
OFF-PA-10001445,"Eaton Cards & Envelopes, Multicolor",Office Supplies,Paper,46.59,8.076345394740311
TEC-HEW-10002302,"Hewlett Copy Machine, Color",Technology,Copiers,261.87,63.45326680348504
FUR-CH-10004600,"Harbour Creations Chairmat, Red",Furniture,Chairs,72,7.365754753656153
OFF-AP-10003834,"KitchenAid Stove, Red",Office Supplies,Appliances,380.1,127.80842646230747
TEC-PH-10002597,Xblue XB-1670-86 X16 SmallOffice Telephone- Titanium,Technology,Phones,125.99,29.12500911668028
TEC-CO-10001221,"Brother Fax and Copier, Laser",Technology,Copiers,127.66,36.44197853476401
TEC-CO-10004128,"Brother Fax and Copier, Color",Technology,Copiers,128.62,96.92658033660496
FUR-BO-10003661,"Sauder Floating Shelf Set, Traditional",Furniture,Bookcases,194.58,21.592038889189382
TEC-MA-10003101,"Panasonic Receipt Printer, Wireless",Technology,Machines,120.9,14.52314886758702
TEC-CO-10002587,"Sharp Fax and Copier, Laser",Technology,Copiers,168.6,15.079854538112897
OFF-AP-10003382,"Breville Stove, White",Office Supplies,Appliances,559.68,16.496245148569635
TEC-AC-10002218,"Memorex Keyboard, Erganomic",Technology,Accessories,69.15,54.576612006815054
FUR-SAU-10000637,"Sauder Library with Doors, Metal",Furniture,Bookcases,387.09,1.8809168830768663
TEC-CO-10002197,"Hewlett Fax and Copier, High-Speed",Technology,Copiers,191.07,33.51976146162781
TEC-AC-10002637,LogitechVX Revolution Cordless Laser Mouse for Notebooks (Black),Technology,Accessories,179.99,2.801439727533726
TEC-CO-10004152,"HP Ink, Laser",Technology,Copiers,85.8,4.65479751260584
FUR-BO-10003287,"Dania Corner Shelving, Traditional",Furniture,Bookcases,81.38,61.90394627303447
FUR-FU-10003414,"Tenex Clock, Duo Pack",Furniture,Furnishings,50.31,13.221792605775121
TEC-CO-10001042,"Sharp Fax and Copier, High-Speed",Technology,Copiers,111.2,9.439903626031986
FUR-SAF-10001428,"Safco Corner Shelving, Pine",Furniture,Bookcases,150.81,71.52908233001133
TEC-CO-10003406,"HP Fax and Copier, Laser",Technology,Copiers,172.89,37.98014529208525
OFF-PA-10001466,"Eaton Computer Printout Paper, 8.5 x 11",Office Supplies,Paper,30.69,2.2665759200395716
OFF-AR-10000380,"Hunt PowerHouse Electric Pencil Sharpener, Blue",Office Supplies,Art,37.98,17.086517806396465
OFF-ROG-10003993,"Rogers File Cart, Single Width",Office Supplies,Storage,141.63,7.022213673053122
TEC-HP -10000081,"HP Ink, Color",Technology,Copiers,130.14,66.50790152144323
FUR-FU-10001085,3M Polarizing Light Filter Sleeves,Furniture,Furnishings,18.65,2.7430156662798364
OFF-EN-10003360,"Kraft Mailers, with clear poly window",Office Supplies,Envelopes,41.19,24.57663237713004
FUR-FU-10000747,Tenex B1-RE Series Chair Mats for Low Pile Carpets,Furniture,Furnishings,45.98,2.4611596878669846
OFF-BI-10003934,"Acco Binding Machine, Clear",Office Supplies,Binders,33.7,2.2800451858536976
TEC-MA-10001627,"Konica Printer, White",Technology,Machines,266.25,75.89623791944528
FUR-BO-10001537,"Ikea Corner Shelving, Metal",Furniture,Bookcases,122.52,43.08949063645728
FUR-TA-10001285,"Chromcraft Conference Table, Fully Assembled",Furniture,Tables,582.76,295.5429548891829
TEC-AC-10003417,"SanDisk Memory Card, Programmable",Technology,Accessories,113.91,7.87646464965421
TEC-PH-10002898,"Samsung Smart Phone, Full Size",Technology,Phones,637.44,206.1034546720188
FUR-FU-10001144,"Rubbermaid Photo Frame, Erganomic",Furniture,Furnishings,50.37,28.22257733226414
TEC-PH-10002152,"Apple Headset, Cordless",Technology,Phones,76.11,8.27959533844878
TEC-PH-10004271,"Cisco Speaker Phone, VoIP",Technology,Phones,138.57,34.70244375782388
OFF-BIN-10000772,"Binney & Smith Pencil Sharpener, Water Color",Office Supplies,Art,29.85,7.364800652277942
FUR-HON-10002941,"Hon Swivel Stool, Set of Two",Furniture,Chairs,165.9,46.11668632653087
FUR-CH-10000399,"Hon Swivel Stool, Set of Two",Furniture,Chairs,165.9,55.43609878648169
TEC-MA-10002468,"Panasonic Inkjet, White",Technology,Machines,310.5,104.22433050330073
FUR-TA-10002095,"Lesro Training Table, Fully Assembled",Furniture,Tables,270.27,27.566513242012917
FUR-TA-10004005,"Bevis Coffee Table, Rectangular",Furniture,Tables,315.75,42.476903955496596
TEC-CO-10002916,"Hewlett Ink, Color",Technology,Copiers,150.12,99.98089332430432
OFF-HAM-10003628,"Hamilton Beach Coffee Grinder, Red",Office Supplies,Appliances,42.66,33.75486344957386
TEC-PH-10003400,"Motorola Signal Booster, VoIP",Technology,Phones,143.22,7.553047872760633
TEC-PH-10004531,AT&T CL2909,Technology,Phones,125.99,12.952282503834182
TEC-MA-10003730,"StarTech Card Printer, White",Technology,Machines,107.94,27.399510369005714
TEC-AC-10000354,"Belkin Numeric Keypad, USB",Technology,Accessories,55.56,65.20327864133668
FUR-CH-10003848,"Office Star Rocking Chair, Adjustable",Furniture,Chairs,143.4,1.1535188157165044
FUR-NOV-10001972,"Novimex Swivel Stool, Red",Furniture,Chairs,164.46,43.07833102049021
TEC-PH-10002033,Konftel 250 Conferencephone- Charcoal black,Technology,Phones,284.82,33.808124757987216
FUR-BO-10002214,"Dania Floating Shelf Set, Traditional",Furniture,Bookcases,112.9,32.78735019104718
TEC-PH-10003691,BlackBerry Q10,Technology,Phones,125.99,17.43137448115282
OFF-BI-10002040,"Ibico 3-Hole Punch, Recycled",Office Supplies,Binders,30.81,4.477808709785213
FUR-HON-10001851,"Hon Executive Leather Armchair, Black",Furniture,Chairs,457.14,4.500606380144177
OFF-SME-10002740,"Smead Lockers, Single Width",Office Supplies,Storage,198.45,6.655035063668958
TEC-PH-10000303,"Samsung Smart Phone, VoIP",Technology,Phones,636.24,69.17027709857567
FUR-BO-10004699,"Dania 3-Shelf Cabinet, Mobile",Furniture,Bookcases,143.97,25.18275005864731
FUR-TA-10002972,"Barricks Computer Table, Fully Assembled",Furniture,Tables,479.31,58.46501488293956
TEC-CO-10003694,"Brother Wireless Fax, Color",Technology,Copiers,253.5,52.66907685379843
TEC-BRO-10000663,"Brother Fax and Copier, Color",Technology,Copiers,192.93,119.72475940952006
TEC-CO-10004756,"Sharp Wireless Fax, Digital",Technology,Copiers,355.56,11.39638431548746
FUR-BO-10001326,"Bush 3-Shelf Cabinet, Pine",Furniture,Bookcases,144.72,29.906230961635078
TEC-AC-10003403,"Enermax Router, USB",Technology,Accessories,258.54,47.65863814631361
TEC-MA-10003170,"Konica Calculator, Wireless",Technology,Machines,51.63,16.247956475486326
FUR-BO-10001165,"Bush Library with Doors, Mobile",Furniture,Bookcases,366.84,46.1448120390955
TEC-SAM-10001843,"Samsung Audio Dock, Full Size",Technology,Phones,168.12,97.21583278297213
OFF-BI-10002794,"Avery Trapezoid Ring Binder, 3"" Capacity, Black, 1040 sheets",Office Supplies,Binders,40.98,2.501389267544653
TEC-CAN-10001981,"Canon Ink, High-Speed",Technology,Copiers,145.35,88.65564250488507
TEC-MA-10002040,"Panasonic Card Printer, Durable",Technology,Machines,115.96,42.06151665906799
OFF-AP-10000078,"Breville Toaster, Silver",Office Supplies,Appliances,77.46,7.201186992737275
TEC-AC-10002688,"Memorex Memory Card, Bluetooth",Technology,Accessories,102.27,25.326185458558477
TEC-MOT-10001927,"Motorola Speaker Phone, VoIP",Technology,Phones,129.87,14.079936901574072
FUR-BO-10001934,"Bush Library with Doors, Metal",Furniture,Bookcases,363.78,59.62362220739861
TEC-CO-10004263,"Hewlett Personal Copier, Laser",Technology,Copiers,144.27,24.23723653568096
FUR-OFF-10003688,"Office Star Rocking Chair, Black",Furniture,Chairs,138.48,3.549972871119619
TEC-AC-10001500,"Logitech Memory Card, Erganomic",Technology,Accessories,101.19,12.64776674768723
OFF-AP-10002534,3.6 Cubic Foot Counter Height Office Refrigerator,Office Supplies,Appliances,294.62,101.88933712668164
TEC-CO-10002122,"Hewlett Fax Machine, Digital",Technology,Copiers,319.56,156.4693832550384
FUR-BO-10002213,DMI Eclipse Executive Suite Bookcases,Furniture,Bookcases,500.98,14.544178842967543
FUR-TA-10001705,Bush Advantage Collection Round Conference Table,Furniture,Tables,212.6,8.922582730555717
OFF-BI-10002935,"Wilson Jones Binder, Clear",Office Supplies,Binders,12.48,9.968525818143144
FUR-CH-10000430,"SAFCO Rocking Chair, Set of Two",Furniture,Chairs,91.44,3.117901860831743
TEC-MA-10003280,"Panasonic Receipt Printer, White",Technology,Machines,119.31,17.73688320116512
TEC-CO-10002009,"Brother Wireless Fax, High-Speed",Technology,Copiers,251.34,74.11792533360645
TEC-CO-10003048,"Hewlett Wireless Fax, Color",Technology,Copiers,254.42,12.483248143533254
OFF-SU-10002323,"Elite Shears, Steel",Office Supplies,Supplies,30.94,18.16939561472896
TEC-AC-10004571,"Logitech Router, Programmable",Technology,Accessories,248.82,33.48695915788471
OFF-AP-10002675,"Cuisinart Refrigerator, Black",Office Supplies,Appliances,495.51,271.4171670639173
TEC-AC-10000896,"Belkin Numeric Keypad, Erganomic",Technology,Accessories,59.25,9.490162822805376
TEC-PH-10002114,Xiaomi Mi3,Technology,Phones,569.99,310.14272342551726
OFF-PA-10003550,"Eaton Cards & Envelopes, Recycled",Office Supplies,Paper,45.09,10.392147059620491
TEC-AC-10000890,"Belkin Router, USB",Technology,Accessories,172.64,7.672201659761961
FUR-BO-10002352,"Ikea 3-Shelf Cabinet, Mobile",Furniture,Bookcases,96.64,3.6664803077952586
FUR-ELD-10000963,"Eldon Stacking Tray, Durable",Furniture,Furnishings,28.53,18.710144360659708
TEC-MA-10003246,Hewlett-Packard Deskjet D4360 Printer,Technology,Machines,139.99,62.659552708776516
OFF-AP-10000391,"Hamilton Beach Coffee Grinder, Black",Office Supplies,Appliances,42.09,17.760813546717817
TEC-CO-10001654,"Hewlett Wireless Fax, Digital",Technology,Copiers,379.83,5.719741974584411
TEC-CO-10000387,"Hewlett Fax Machine, Color",Technology,Copiers,214.24,13.87635169205731
TEC-MA-10003078,"Epson Printer, White",Technology,Machines,261.03,25.968453808417813
TEC-PH-10000298,"Nokia Speaker Phone, Cordless",Technology,Phones,126,136.04815961762222
FUR-CH-10004606,"Hon Rocking Chair, Red",Furniture,Chairs,130.62,62.57284851526348
TEC-PH-10001573,"Nokia Smart Phone, with Caller ID",Technology,Phones,638.91,17.38591893887773
OFF-PA-10001258,"Green Bar Cards & Envelopes, Multicolor",Office Supplies,Paper,49.8,8.617585890935496
FUR-TA-10004817,"Lesro Coffee Table, with Bottom Storage",Furniture,Tables,252,253.1377869159018
TEC-PH-10003927,"Cisco Signal Booster, Full Size",Technology,Phones,153.12,8.454721039875702
TEC-STA-10001994,"StarTech Printer, Wireless",Technology,Machines,256.17,21.202518307187745
FUR-CH-10000513,High-Back Leather Manager's Chair,Furniture,Chairs,129.99,41.138648035015365
OFF-EN-10003785,"GlobeWeis Mailers, Set of 50",Office Supplies,Envelopes,38.55,11.188548667126138
FUR-CH-10004196,"Novimex Swivel Stool, Red",Furniture,Chairs,164.46,25.740493098237717
TEC-CO-10002119,"Sharp Fax Machine, Digital",Technology,Copiers,295.29,9.73656528951739
TEC-PH-10004614,"Cisco Headset, Full Size",Technology,Phones,89.73,15.12025088509498
FUR-IKE-10002268,"Ikea Floating Shelf Set, Metal",Furniture,Bookcases,169.8,112.34987664627731
TEC-CO-10004664,"Hewlett Personal Copier, Color",Technology,Copiers,145.71,107.40676523118593
TEC-CO-10001633,"Sharp Fax Machine, High-Speed",Technology,Copiers,293.85,15.54906378644649
TEC-PH-10000688,"Nokia Speaker Phone, VoIP",Technology,Phones,123.24,84.54326265092648
FUR-DAN-10003011,"Dania Corner Shelving, Metal",Furniture,Bookcases,121.53,5.8478108021693265
TEC-CO-10001204,"Canon Fax Machine, High-Speed",Technology,Copiers,316.59,40.581422575325476
OFF-AP-10001305,"Breville Microwave, White",Office Supplies,Appliances,299.85,7.8182740998545475
OFF-PA-10003228,Xerox 1917,Office Supplies,Paper,48.91,1.6485497965147342
OFF-ST-10003953,"Smead File Cart, Industrial",Office Supplies,Storage,128.4,2.8633830853592976
FUR-FU-10003736,"Rubbermaid Frame, Duo Pack",Furniture,Furnishings,109.95,12.656825704668409
TEC-CO-10000262,"Brother Ink, Laser",Technology,Copiers,98.2,44.39727337982523
OFF-ST-10001999,"Tenex Folders, Wire Frame",Office Supplies,Storage,22.29,7.221810968782126
FUR-BO-10002632,"Sauder Corner Shelving, Pine",Furniture,Bookcases,148.65,6.630165573581479
OFF-ROG-10001399,"Rogers Shelving, Single Width",Office Supplies,Storage,62.16,41.192483921062866
FUR-ELD-10004973,"Eldon Clock, Black",Furniture,Furnishings,56.52,3.5596139964157527
TEC-AC-10000254,"Belkin Keyboard, Programmable",Technology,Accessories,85.38,6.91676970226594
FUR-FU-10003918,"Advantus Photo Frame, Black",Furniture,Furnishings,52.98,8.200963151768141
FUR-BO-10000847,"Dania Stackable Bookrack, Mobile",Furniture,Bookcases,121.59,17.950583059997665
FUR-CH-10002335,Hon GuestStacker Chair,Furniture,Chairs,226.67,18.749936775407843
OFF-ST-10003150,"Smead Lockers, Wire Frame",Office Supplies,Storage,197.49,52.80134831775777
TEC-CO-10000129,"Brother Fax and Copier, Color",Technology,Copiers,192.93,15.814152241025694
FUR-CH-10004062,"Office Star Rocking Chair, Adjustable",Furniture,Chairs,95.6,5.565685824516345
OFF-ST-10002499,"Fellowes Shelving, Single Width",Office Supplies,Storage,57.87,35.97760265281289
TEC-CO-10000778,"Sharp Fax and Copier, Color",Technology,Copiers,170.04,0.7503747389535084
FUR-BO-10001876,"Safco Corner Shelving, Pine",Furniture,Bookcases,150.81,109.3570128054206
TEC-PH-10002183,"Apple Audio Dock, with Caller ID",Technology,Phones,111.26,8.63107241354245
OFF-ELD-10000024,"Eldon Folders, Blue",Office Supplies,Storage,16.98,5.005647379656849
OFF-AP-10003182,"Breville Toaster, Silver",Office Supplies,Appliances,77.46,47.99971793468134
TEC-AC-10001254,"Enermax Memory Card, Programmable",Technology,Accessories,115.89,10.270139835091637
TEC-CO-10001968,"Sharp Ink, High-Speed",Technology,Copiers,81.74,2.2271123066199148
TEC-MA-10002264,"Panasonic Printer, Durable",Technology,Machines,266.61,2.689160289403434
OFF-ST-10002506,"Smead Lockers, Blue",Office Supplies,Storage,198.42,57.30287620188932
TEC-PH-10003505,Geemarc AmpliPOWER60,Technology,Phones,92.8,14.253250127171396
OFF-PA-10003884,"Eaton Message Books, Multicolor",Office Supplies,Paper,21.99,0.24815636618486847
TEC-PH-10003011,"Cisco Audio Dock, Full Size",Technology,Phones,122.24,51.710821385162255
OFF-SU-10000171,"Elite Trimmer, Easy Grip",Office Supplies,Supplies,43.29,4.818722834850192
OFF-AR-10003110,"Sanford Sketch Pad, Water Color",Office Supplies,Art,48.66,17.456503017448718
FUR-HON-10003533,"Hon Executive Leather Armchair, Adjustable",Furniture,Chairs,459.63,104.34221422876878
OFF-PA-10001371,"Xerox Computer Printout Paper, 8.5 x 11",Office Supplies,Paper,30.48,3.754278829050307
TEC-PH-10004505,"Nokia Smart Phone, Full Size",Technology,Phones,637.35,92.81577401750535
OFF-ST-10002598,"Tenex Shelving, Industrial",Office Supplies,Storage,36.76,11.403273510005663
TEC-MA-10003353,Xerox WorkCentre 6505DN Laser Multifunction Printer,Technology,Machines,599.99,240.98318419554735
FUR-BO-10003991,"Bush Classic Bookcase, Traditional",Furniture,Bookcases,412.68,27.051835372084902
OFF-PA-10004155,"Eaton Computer Printout Paper, 8.5 x 11",Office Supplies,Paper,20.46,10.457800170379093
OFF-SU-10001087,"Elite Shears, Easy Grip",Office Supplies,Supplies,48.63,58.829416477316336
TEC-NOK-10002555,"Nokia Audio Dock, VoIP",Technology,Phones,166.83,95.41913822581968
OFF-EN-10002924,"GlobeWeis Interoffice Envelope, Security-Tint",Office Supplies,Envelopes,50.22,6.133376167824906
OFF-HAM-10001302,"Hamilton Beach Microwave, White",Office Supplies,Appliances,280.65,0.8261941079318457
OFF-SU-10001308,"Fiskars Trimmer, Serrated",Office Supplies,Supplies,39,0.8575358973276647
FUR-BO-10003688,"Bush Stackable Bookrack, Pine",Furniture,Bookcases,84.02,2.938249715650196
OFF-ST-10004947,"Fellowes File Cart, Industrial",Office Supplies,Storage,137.79,28.005087580066107
OFF-AR-10000780,"BIC Highlighters, Easy-Erase",Office Supplies,Art,19.2,11.798190253456205
TEC-AC-10003640,"SanDisk Mouse, Programmable",Technology,Accessories,39.81,28.98328857338352
TEC-AC-10003832,Imation16GB Mini TravelDrive USB 2.0Flash Drive,Technology,Accessories,33.13,11.446112374500293
FUR-DAN-10002314,"Dania Stackable Bookrack, Traditional",Furniture,Bookcases,121.05,12.574778652876097
TEC-CO-10001864,"Brother Ink, High-Speed",Technology,Copiers,145.5,59.4110633077504
FUR-BAR-10003576,"Barricks Training Table, with Bottom Storage",Furniture,Tables,318.3,142.0090595937084
TEC-BEL-10002324,"Belkin Keyboard, Bluetooth",Technology,Accessories,83.88,59.1941548000246
FUR-FU-10000432,"Eldon Clock, Black",Furniture,Furnishings,56.52,27.164166126366425
OFF-AR-10001694,"Sanford Canvas, Blue",Office Supplies,Art,33.68,29.043399623743607
FUR-DAN-10002348,"Dania Classic Bookcase, Pine",Furniture,Bookcases,412.11,195.7488008684915
OFF-AP-10001190,"Hoover Refrigerator, Silver",Office Supplies,Appliances,527.01,122.93030934757394
TEC-AC-10000519,"Belkin Keyboard, Programmable",Technology,Accessories,85.38,27.037220687422764
FUR-CH-10003499,"SAFCO Swivel Stool, Red",Furniture,Chairs,167.94,14.614392062007742
FUR-BO-10000670,"Dania Corner Shelving, Metal",Furniture,Bookcases,121.53,24.389286220388392
FUR-BAR-10003532,"Barricks Conference Table, Rectangular",Furniture,Tables,904.65,156.69876658097607
OFF-BI-10002026,Ibico Recycled Linen-Style Covers,Office Supplies,Binders,39.06,12.631821320469134
OFF-PA-10004294,"Xerox Computer Printout Paper, 8.5 x 11",Office Supplies,Paper,20.32,10.333007131390865
OFF-AME-10001009,"Ames Interoffice Envelope, Set of 50",Office Supplies,Envelopes,45.12,4.247655360574019
TEC-PH-10001557,"Apple Speaker Phone, VoIP",Technology,Phones,123.39,1.289190389859229
FUR-FU-10003046,"Advantus Photo Frame, Durable",Furniture,Furnishings,50.01,7.669740083108007
FUR-BO-10003034,"O'Sullivan Elevations Bookcase, Cherry Finish",Furniture,Bookcases,130.98,57.13808691305656
FUR-TA-10004744,"Lesro Conference Table, with Bottom Storage",Furniture,Tables,857.58,108.52141929111743
FUR-FU-10001091,"Eldon Photo Frame, Erganomic",Furniture,Furnishings,56.73,44.78416900770073
TEC-PH-10000437,"Cisco Signal Booster, VoIP",Technology,Phones,151.92,15.765519814604557
FUR-BO-10001943,"Safco Library with Doors, Traditional",Furniture,Bookcases,389.79,77.07609489312905
TEC-PH-10001459,Samsung Galaxy Mega 6.3,Technology,Phones,419.99,9.617760688603173
FUR-DEF-10000495,"Deflect-O Clock, Black",Furniture,Furnishings,50.31,35.17099876099795
FUR-CH-10003836,"Harbour Creations Rocking Chair, Red",Furniture,Chairs,147.09,13.486598579750675
TEC-AC-10003159,"SanDisk Router, USB",Technology,Accessories,171.04,0.8216744736421595
TEC-PH-10003932,"Apple Audio Dock, VoIP",Technology,Phones,111.32,10.482993046596532
TEC-CO-10001846,"Hewlett Fax and Copier, Digital",Technology,Copiers,192.51,125.69386432312916
FUR-FU-10004954,"Tenex Clock, Duo Pack",Furniture,Furnishings,50.31,18.486446148463106
TEC-PH-10004544,"Motorola Speaker Phone, with Caller ID",Technology,Phones,129.78,54.48830361724587
TEC-EPS-10003962,"Epson Card Printer, Durable",Technology,Machines,170.07,46.87498241690024
TEC-PH-10004552,"Motorola Office Telephone, Full Size",Technology,Phones,73.05,4.6555769640667295
